{
  "inventory_id": "corpus_inventory_v4_fixture",
  "corpus_version": "v4",
  "created_date": "2026-08-13",
  "description": "Minimal v4 fixture inventory for isolated corpus pipeline tests.",
  "source_files": [
    {
      "path": "tests/fixtures/corpus-v4/valid-corpus-document.json",
      "role": "inventory_source",
      "notes": "Valid document metadata fixture."
    },
    {
      "path": "tests/fixtures/corpus-v4/sample-raw-document.txt",
      "role": "inventory_source",
      "notes": "Raw text fixture corresponding to doc_901."
    },
    {
      "path": "tests/fixtures/corpus-v4/sample-segmented-document.json",
      "role": "generated_output",
      "notes": "Segmented fixture corresponding to doc_901."
    }
  ],
  "document_count": 1,
  "tier_counts": {
    "v1": 0,
    "v4_core": 1,
    "v4_validation": 1,
    "v4_reference": 1
  },
  "documents": [
    {
      "doc_id": "doc_901",
      "corpus_version": "v4",
      "corpus_tier": "v4-core",
      "title": "Sample V4 Fixture Address",
      "short_title": "Fixture Address",
      "date": "1860-01-01",
      "date_precision": "exact",
      "year": 1860,
      "period": "secession_crisis",
      "genre": "speech",
      "audience": "public",
      "rhetorical_function": [
        "fixture_validation"
      ],
      "research_relevance": [
        "pipeline_fixture"
      ],
      "source_authority": "Collected Works of Abraham Lincoln",
      "source_url": "https://example.test/lincoln/doc_901",
      "source_citation": "Fixture collected-works citation for doc_901.",
      "edition_notes": "Synthetic fixture record for corpus v4 tests.",
      "text_status": "complete",
      "authorship_status": "secure",
      "included_in_v1": false,
      "included_in_v4_core": true,
      "included_in_v4_validation": true,
      "included_in_v4_reference": true,
      "annotation_status": "segmented",
      "provenance_notes": "Synthetic fixture provenance; not a research source.",
      "selection_rationale": "Exercises v4 corpus metadata and ingestion fixture tests."
    }
  ]
}
